ID,Nombre
3901,"ADAPTADOR (CADDY) GRUESO HDD"
3903,"ADAPTADOR BAFO BF-1284, USB A IEEE 1284 PARALELO PUERTO 36 PIN CABLE ADAPTADOR DE IMPRESORA"
3905,"ADAPTADOR DE DISPLAYPORT A HDMI"
3906,"ADAPTADOR DE ENCHUFE DE 3 A 2 ESPIGA PLANA - OPALUX"
3907,"ADAPTADOR DE HDMI A VGA AUDIO AUX (ER-9) DELUXE HDTV TO VGA & AUDIO"
3908,"ADAPTADOR DE HDMI A VGA, HD CONVERSION CABLE"
3909,"ADAPTADOR DE RED D-LINK DUB-1312, USB 3.0 Y PUERTO RJ-45 GIGABIT ETHERNET"
3910,"ADAPTADOR DE RED XTECH XTC-375 USB 3.0 A RJ-45 ETHERNET"
3911,"ADAPTADOR DE TIPO V8 A USB GENERICO OTG"
3912,"ADAPTADOR DE VÍDEO XTECH XTC-363 HDMI MACHO A VGA HEMBRA"
3913,"ADAPTADOR HDMI HEMBRA TO HEMBRA"
3914,"ADAPTADOR HP DISPLAYPORT A VGA - 752661-004"
3915,"ADAPTADOR JETION HDMI A USB 3.0, HEMBRA, FLEXIBLE, NEGRO HDCP"
3916,"ADAPTADOR MONITOR PARA VIDEO XTECH (XTC550) ,TIPO C MACHO A VGA HEMBRA,20CM, COLOR BLANCO"
3917,"ADAPTADOR MULTIPUERTO USB TIPO C XTECH 3-EN-1 (XTC-565)"
3918,"ADAPTADOR PCI-EXPRESS SERIAL ENCORE EN-PCIE-2S"
3919,"ADAPTADOR PCIE TP-LINK ARCHER TX3000E WI-FI 6 AX3000 BLUETOOTH 5.0"
3920,"ADAPTADOR PCIE TP-LINK ARCHER TX55E WI-FI 6 AX3000 BLUETOOTH 5.2 (0152502373)"
3921,"ADAPTADOR SOPORTE UNIVERSAL PARA ESPEJO RETROVISOR DE COCHE (TCH059)"
3922,"ADAPTADOR SSU MULTIPLICADOR PCI X1 A USB X4 3.0"
3923,"ADAPTADOR TP-LINK INALAMBRICO ARCHER T2UB NANO AC600/USB/ BLUETOOTH 4.2"
3924,"ADAPTADOR TP-LINK PCI-EXPRESS ARCHER T4E RED WI-FI, DOBLE BANDA, DOS ANTENAS"
3925,"ADAPTADOR TP-LINK TL-WN822N, USB WIFI 802.11 B/G/N 300MBPS, USB WIRELESS, 2.4GHZ, 2 ANTENAS"
3926,"ADAPTADOR USB BLUETOOTH 5.3 TP-LINK UB500 PARA PC Y LAPTOP, 20MTS WIN 11/10/8.1/7 NEGRO"
3927,"ADAPTADOR VGA A DVI"
3928,"ADAPTADOR WIFI BANDA DUAL 2.4 Y 5.0 TIPO USB"
3929,"ADAPTADOR XTECH HDMI HEMBRA A HDMI HEMBRA (XTC333)"
3930,"ADELANTO DE PEDIDO"
3931,"ALCOHOL GEL SANITIZANTE ORION (1000 ML) 1LT, ICE CLEAR"
3932,"ALCOHOL ISOPROPILICO 99% . BRISOL"
3933,"ALL-IN-ONE HP 200 G4 22, 21.5"" WLED FHD, INTEL CORE I5-10210U 1.60GHZ 8GB DDR4, 1TB SATA. (193L6LT#ABM)"
3934,"ANTENA WIFI WIRELESS USB 2.0 802.11N INALAMBRICO ADAPTADOR"
3935,"ANTIVIRUS ESET NOD32 AVNOD32 AV 1 PC 2X1 2025 Y 1 LIC MOBILE (S11010227)"
3936,"ANTIVIRUS ESET NOD32 MULTIDEVICE SECURITY PARA 10 PCS (S11030111)"
3937,"ANTIVIRUS ESET NOD32 PARA 3 PCS 2025 (S11030191)"
3938,"ANTIVIRUS ESET NOD32, 5 PC, 1 AÍ‘O 2023"
3939,"ANTIVIRUS PARA 10 PCS KASPERSKY SMALL OFFICE SECURITY, COMPATIBLE CON WINDOWS 100"
3940,"AROS LED TIK TOK ,PACK ARO+TRIPIDE DE 2.0 M,RING FILL LIGHT ARO 26 CM,5V,USB"
3941,"ASUS GEFORCE RTX 5050 8GB GDDR6 128BITS OC DUAL (PN:90YV0N72-M0AA00)"
3942,"AUDÍFONO CORSAIR HS35 ESTEREO GAMING CON MICROFONO ROJO/NEGRO"
3943,"AUDÍFONO DE CONDUCCIÓN DE AIRE TEROS TE-8078R, BLUETOOTH, ROJO /GRIS"
3944,"AUDIFONO GAMING HEADSET HALION (S5) LED LIGHT"
3945,"AUDIFONO GENIUS (GHP-300B) ULTRA SLIM, COLOR PINK, PLUGIN 3.5."
3946,"AUDIFONO HALION GAMING HEADSET XI5 VIPER ROJO/NEGRO"
3947,"AUDIFONO HALION T50 C/MICROFONO"
3948,"AUDÍFONO INALÁMBRICO ANC TEROS TE-8033N (HEADSET), NEGRO"
3949,"AUDÍFONO KLIP XTREME CON MICROFONO ESTÍ‰REO KHS-620RD ROJO, ON-EAR BLUETOOH"
3950,"AUDIFONO KLIP XTREME FURY KHS-620SV BLUETOOTH, PLATA"
3951,"AUDÍFONO KLIP XTREME KSH-270 CON MICRÓFONO ESTÍ‰REO CON MICRÓFONO PARA PC 2 JACK"
3952,"AUDÍFONO LOGITECH H111, ESTÍ‰REO, MICRÓFONO, CONECTOR 3.5MM, GRIS. (981-000612)"
